{
  "contract_version": "0.1.0",
  "skill": "calculate-co2e",
  "state": {
    "contract_version": "0.1.0",
    "revision": 0,
    "organization": {
      "id": "org-001",
      "name": "Fictional Example Company",
      "sector": "manufacturing"
    },
    "facilities": [
      {
        "id": "facility-001",
        "name": "Fictional plant",
        "jurisdiction": "CA-ON"
      }
    ],
    "jurisdictions": [
      "CA",
      "CA-ON"
    ],
    "reporting_period": {
      "start": "2025-01-01",
      "end": "2025-12-31"
    },
    "organizational_boundary": {
      "id": "boundary-001",
      "approach": "operational control (fixture only)",
      "facility_ids": [
        "facility-001"
      ],
      "exclusions": [],
      "evidence_ids": []
    },
    "evidence": [
      {
        "id": "ev-001",
        "source": {
          "locator": "fixture:meter-001",
          "title": "Fictional annual electricity record",
          "publisher": "Fictional Example Company",
          "accessed": "2026-10-04",
          "version": "fixture-1",
          "tier": 1
        },
        "method": {
          "name": "Synthetic meter reading fixture",
          "version": "fixture-1",
          "source": "fixture:meter-001"
        },
        "period": {
          "start": "2025-01-01",
          "end": "2025-12-31"
        },
        "unit": "kWh",
        "boundary_id": "boundary-001",
        "geography": "CA-ON",
        "quality": {
          "reliability": "unknown",
          "completeness": "complete",
          "fitness_notes": "Synthetic fixture, not independently verified."
        },
        "assumption": null,
        "uncertainty": {
          "kind": "unquantified",
          "description": "Fictional meter uncertainty is not quantified.",
          "value": null,
          "unit": null
        },
        "calculation": null
      },
      {
        "id": "factor-evidence",
        "source": {
          "locator": "fixture:factor",
          "title": "Synthetic emission-factor fixture",
          "publisher": "Fictional Example Company",
          "accessed": "2026-10-04",
          "version": "fixture-1",
          "tier": 1
        },
        "method": {
          "name": "Synthetic meter reading fixture",
          "version": "fixture-1",
          "source": "fixture:meter-001"
        },
        "period": {
          "start": "2025-01-01",
          "end": "2025-12-31"
        },
        "unit": "kg CO2e/kWh",
        "boundary_id": "boundary-001",
        "geography": "CA-ON",
        "quality": {
          "reliability": "unknown",
          "completeness": "complete",
          "fitness_notes": "Synthetic fixture, not independently verified."
        },
        "assumption": null,
        "uncertainty": {
          "kind": "unquantified",
          "description": "Fictional meter uncertainty is not quantified.",
          "value": null,
          "unit": null
        },
        "calculation": null
      }
    ],
    "results": [
      {
        "id": "res-001",
        "skill": "normalize-sustainability-data",
        "contract_version": "0.1.0",
        "status": "completed",
        "review_states": [
          "ANALYTICAL"
        ],
        "review_requirements": [],
        "metrics": [
          {
            "id": "metric-001",
            "name": "Recorded electricity",
            "value": 1000,
            "unit": "kWh",
            "period": {
              "start": "2025-01-01",
              "end": "2025-12-31"
            },
            "boundary_id": "boundary-001",
            "evidence_ids": [
              "ev-001"
            ],
            "method": {
              "name": "Synthetic meter reading fixture",
              "version": "fixture-1",
              "source": "fixture:meter-001"
            },
            "assumption": null,
            "uncertainty": {
              "kind": "unquantified",
              "description": "Fictional meter uncertainty is not quantified.",
              "value": null,
              "unit": null
            },
            "calculation": {
              "formula": "recorded quantity",
              "inputs": [
                "ev-001"
              ],
              "conversions": [],
              "rounding": "none"
            }
          }
        ],
        "evidence_ids": [
          "ev-001"
        ],
        "assumptions": [],
        "data_gaps": [],
        "diagnostics": [],
        "next_actions": []
      }
    ],
    "assumptions": [],
    "data_gaps": [],
    "review_requirements": [],
    "energy": [
      "res-001"
    ],
    "water": [],
    "materials": [],
    "waste": [],
    "ghg": {
      "scope_1": [],
      "scope_2": [],
      "scope_3": []
    },
    "suppliers": [],
    "targets": [],
    "risks": [],
    "opportunities": [],
    "projects": [],
    "frameworks": [],
    "emission_factors": [
      {
        "id": "synthetic-factor",
        "value": 0.5,
        "unit": "kg CO2e/kWh",
        "source": {
          "locator": "fixture:factor",
          "publisher": "Fictional fixture publisher",
          "version": "fixture-1",
          "accessed": "2026-10-04"
        },
        "geography": "CA-ON",
        "vintage_year": 2025,
        "method": {
          "name": "Synthetic CO2e calculation",
          "version": "fixture-1",
          "source": "fixture:method"
        },
        "gwp_basis": "Synthetic fixture basis",
        "evidence_ids": [
          "factor-evidence"
        ],
        "status": "synthetic"
      }
    ]
  },
  "parameters": {
    "activity_id": "metric-001",
    "factor_id": "synthetic-factor",
    "policy": {
      "geography": "CA-ON",
      "acceptable_vintages": [
        2025
      ],
      "method": {
        "name": "Synthetic CO2e calculation",
        "version": "fixture-1",
        "source": "fixture:method"
      },
      "gwp_basis": "Synthetic fixture basis",
      "source_review": {
        "factor_id": "synthetic-factor",
        "activity_id": "metric-001",
        "source_locator": "fixture:factor",
        "source_version": "fixture-1",
        "confirmed_value": 0.5,
        "confirmed_unit": "kg CO2e/kWh",
        "evidence_ids": [
          "factor-evidence"
        ],
        "reviewer": "Fictional fixture reviewer",
        "coverage": "Fictional activity only",
        "rationale": "Synthetic factor supplied solely to test arithmetic and provenance, not for real use."
      }
    },
    "result_id": "synthetic-co2e",
    "fixture_mode": true
  }
}
